0x00000: 0x14, 0x1E, 0xC4, 0xC1, 0x00, 0x00, 0x01, 0xC0, 0x02, 0x00, 0x02, 0x00, 0x08, 0x09, 0x84, 0x00.
0x00010: 0xA4, 0x1F, 0x30, 0x2A, 0x76, 0x2F, 0xBC, 0x34, 0x48, 0x3F, 0x60, 0x54, 0x78, 0x69, 0xD6, 0x83.
0x00020: 0x00, 0x00, 0x00, 0x00, 0x00, 0x00, 0x00, 0x00, 0x00, 0x00, 0x00, 0x00, 0x00, 0x00, 0x05, 0x01.
0x00060: 0x01, 0x21, 0x00, 0x76, 0x0A, 0x02, 0x01, 0x80, 0x00, 0x01, 0x06, 0x66, 0x08, 0x00, 0x00, 0x00.
0x00070: 0x04, 0x7A, 0x00, 0x00, 0x04, 0x00, 0x00, 0x00, 0x00, 0x00, 0x00, 0x00, 0x00, 0x00, 0x00, 0x00.
0x00090: 0xBE, 0x00, 0x00, 0x00, 0x00, 0x00, 0x00, 0x00, 0x00, 0x00, 0x00, 0x00, 0x00, 0x00, 0x00, 0x00.
0x000B0: 0x07, 0xA0, 0x00, 0x00, 0x04, 0x00, 0x00, 0x00, 0x00, 0x00, 0x00, 0x00, 0x00, 0x00, 0x00, 0x00.
0x00100: 0x1E, 0x84, 0x00, 0x00, 0x00, 0x00, 0x00, 0xD0, 0x01, 0x00, 0x01, 0x00, 0x00, 0x00, 0x00, 0x00.
0x00110: 0x00, 0x00, 0x00, 0x00, 0x00, 0x04, 0x07, 0x00, 0x00, 0x00, 0x00, 0x00, 0x00, 0x00, 0x00, 0x00.
0x00160: 0x01, 0x00, 0x00, 0x00, 0x00, 0x00, 0x00, 0x00, 0x00, 0x00, 0x00, 0x00, 0x00, 0x00, 0x00, 0x00.
0x00170: 0x00, 0x00, 0x00, 0x00, 0x00, 0x00, 0x00, 0x00, 0x00, 0x00, 0x00, 0x00, 0x00, 0x00, 0x00, 0x00.
0x001B0: 0xFF, 0x81, 0x00, 0x00, 0x00, 0x00, 0x00, 0x00, 0x00, 0x00, 0x00, 0x00, 0x00, 0x00, 0x00, 0x00.
0x00200: 0x01, 0x00, 0x11, 0x11, 0x00, 0x00, 0x00, 0x00, 0x00, 0x00, 0x00, 0x00, 0x00, 0x00, 0x00, 0x00.
0x00210: 0x00, 0x00, 0x00, 0x00, 0x00, 0x00, 0x00, 0x00, 0x00, 0x0A, 0x00, 0x00, 0x00, 0x00, 0x00, 0x00.
0x00220: 0x00, 0x00, 0x00, 0x00, 0x00, 0x00, 0x00, 0x00, 0x00, 0x00, 0x00, 0x00, 0x00, 0x00, 0x00, 0x00.
0x00230: 0x00, 0x00, 0x00, 0x00, 0x00, 0x00, 0x00, 0x00, 0x00, 0x00, 0x00, 0x00, 0x00, 0x00, 0x00, 0x00.
0x00240: 0xBC, 0x80, 0x60, 0x03, 0xCC, 0x96, 0x2B, 0x00, 0x00, 0x00, 0x00, 0x00, 0x00, 0x00, 0x00, 0x00.
0x00310: 0x00, 0x00, 0x00, 0x00, 0x06, 0x00, 0x00, 0x00, 0x00, 0x00, 0x00, 0x00, 0x00, 0x00, 0x00, 0x00.
0x00320: 0x00, 0x00, 0x00, 0x00, 0x00, 0x00, 0x00, 0x00, 0x00, 0x00, 0x00, 0x00, 0x00, 0x00, 0x00, 0x00.
0x00340: 0x00, 0x00, 0x00, 0x00, 0x00, 0x00, 0x00, 0x00, 0x00, 0x00, 0x00, 0x00, 0x00, 0x00, 0x00, 0x00.
0x00350: 0x00, 0x00, 0x00, 0x00, 0x00, 0x00, 0x00, 0x00, 0x00, 0x00, 0x00, 0x00, 0x00, 0x00, 0x00, 0x00.
0x00380: 0x00, 0x00, 0x00, 0x00, 0x00, 0x00, 0x00, 0x00, 0x00, 0x00, 0x00, 0x00, 0x00, 0x00, 0x00, 0x00.
0x003F0: 0x00, 0x00, 0x00, 0x00, 0x00, 0x00, 0x00, 0x00, 0x00, 0x00, 0x00, 0x00, 0x00, 0x00, 0x00, 0x00.
0x00400: 0x38, 0xEC, 0x11, 0x07, 0x01, 0x08, 0x07, 0x08, 0x00, 0x78, 0x03, 0xCB, 0x00, 0x00, 0x00, 0x00.
0x00600: 0x01, 0x00, 0x00, 0x00, 0x00, 0x00, 0x00, 0x00, 0x00, 0x00, 0x00, 0x00, 0x00, 0x00, 0x00, 0x00.
0x00700: 0x06, 0x83, 0x81, 0x0D, 0x00, 0x00, 0x00, 0x00, 0x00, 0x00, 0x00, 0x00, 0x00, 0x00, 0x00, 0x00.
0x00720: 0x80, 0x08, 0x00, 0xFF, 0x08, 0x08, 0x08, 0x00, 0x80, 0x00, 0x00, 0x00, 0x00, 0x00, 0x00, 0x00.
0x00730: 0x00, 0x00, 0x08, 0x14, 0x80, 0x1A, 0x06, 0x00, 0x00, 0x00, 0x00, 0x00, 0x00, 0x00, 0x00, 0x00.
0x007A0: 0x00, 0x00, 0x00, 0x00, 0x00, 0x00, 0x00, 0x00, 0x00, 0x00, 0x00, 0x00, 0x00, 0x00, 0x00, 0x00.
0x02008: 0x02, 0x01, 0x05, 0x00, 0x11, 0x11, 0x80, 0x00, 0x00, 0x00, 0x00, 0x00, 0x00, 0x00, 0x00, 0x00.
0x02200: 0x14, 0x1E, 0xC4, 0xC1, 0x00, 0x00, 0x01, 0xC0, 0x02, 0x00, 0x02, 0x00, 0x08, 0x09, 0x84, 0x00.
0x02210: 0x00, 0x00, 0x00, 0x00, 0x01, 0x00, 0x00, 0x00, 0x00, 0x00, 0x00, 0x00, 0x00, 0x00, 0x00, 0x00.
